{"$schema":"https://json-schema.org/draft/2020-12/schema","title":"Oracle Lab Governance Amendment Exit","type":"object","additionalProperties":false,"required":["schema_version","exit_kind","generated_at","entry","entry_receipt","repositories","reviewed_candidate_heads","candidate_commit_identities","approval_attestation_head","shared_contract","parent_receipts","governance","capture_inputs","codegraph","artifact_chain","disabled_capabilities","exit_digest"],"properties":{"schema_version":{"const":1},"exit_kind":{"const":"governance_amendment_exit"},"generated_at":{"type":"string","format":"date-time"},"entry":{"$ref":"#/$defs/artifact"},"entry_receipt":{"$ref":"#/$defs/artifact"},"repositories":{"type":"object","additionalProperties":false,"required":["cc_gateway","sub2api"],"properties":{"cc_gateway":{"$ref":"#/$defs/repository"},"sub2api":{"$ref":"#/$defs/repository"}}},"reviewed_candidate_heads":{"type":"object","additionalProperties":false,"required":["cc_gateway","sub2api"],"properties":{"cc_gateway":{"$ref":"#/$defs/commit"},"sub2api":{"$ref":"#/$defs/commit"}}},"candidate_commit_identities":{"type":"object","additionalProperties":false,"required":["cc_gateway","sub2api"],"properties":{"cc_gateway":{"$ref":"#/$defs/commit_identity"},"sub2api":{"$ref":"#/$defs/commit_identity"}}},"approval_attestation_head":{"$ref":"#/$defs/commit"},"shared_contract":{"type":"object","additionalProperties":false,"required":["path","digest"],"properties":{"path":{"const":"backend/internal/service/testdata/cc_gateway_formal_pool_contract/vectors.json"},"digest":{"const":"sha256:70c26db06e9135db31d08f097573e3fd55bd9a8894614832eefeecabf6b1a3d1"}}},"parent_receipts":{"type":"object","additionalProperties":false,"required":["phase_zero","post_integration_v2"],"properties":{"phase_zero":{"$ref":"#/$defs/artifact"},"post_integration_v2":{"$ref":"#/$defs/artifact"}}},"governance":{"type":"object","minProperties":11,"maxProperties":11,"propertyNames":{"pattern":"^[a-z_]+$"},"additionalProperties":{"$ref":"#/$defs/artifact"}},"capture_inputs":{"type":"object","minProperties":16,"maxProperties":16,"propertyNames":{"pattern":"^[a-z_]+$"},"additionalProperties":{"$ref":"#/$defs/artifact"}},"codegraph":{"type":"object","additionalProperties":false,"required":["cc_gateway","sub2api"],"properties":{"cc_gateway":{"$ref":"#/$defs/codegraph"},"sub2api":{"$ref":"#/$defs/codegraph"}}},"artifact_chain":{"type":"object","additionalProperties":false,"required":["exit","green","red","results","report","report_markdown","controller_report","controller_report_markdown","context","handoff","receipt"],"properties":{"exit":{"const":"docs/superpowers/evidence/p0-1/p0-1-exit-baseline.json"},"green":{"const":"docs/superpowers/evidence/p0-1/p0-1-green-results.json"},"red":{"const":"docs/superpowers/evidence/p0-1/p0-1-red-results.json"},"results":{"const":"docs/superpowers/evidence/p0-1/p0-1-command-results.json"},"report":{"const":"docs/superpowers/evidence/p0-1/p0-1-exit-report.json"},"report_markdown":{"const":"docs/superpowers/evidence/p0-1/p0-1-exit-report.md"},"controller_report":{"const":"docs/superpowers/evidence/p0-1/controller-final-report.json"},"controller_report_markdown":{"const":"docs/superpowers/evidence/p0-1/controller-final-report.md"},"context":{"const":"docs/superpowers/evidence/p0-1/p0-1-context.json"},"handoff":{"const":"docs/superpowers/evidence/p0-1/p0-1-handoff.json"},"receipt":{"const":"docs/superpowers/evidence/p0-1/p0-1-successor-receipt.json"}}},"disabled_capabilities":{"type":"array","minItems":12,"maxItems":12,"uniqueItems":true,"items":{"type":"string"}},"exit_digest":{"$ref":"#/$defs/digest"}},"$defs":{"digest":{"type":"string","pattern":"^sha256:[0-9a-f]{64}$"},"commit":{"type":"string","pattern":"^[0-9a-f]{40,64}$"},"artifact":{"type":"object","additionalProperties":false,"required":["path","digest"],"properties":{"path":{"type":"string","pattern":"^[A-Za-z0-9._/-]+$"},"digest":{"$ref":"#/$defs/digest"}}},"repository":{"type":"object","additionalProperties":false,"required":["head","branch","clean","snapshot_digest","initial_ignored_inventory"],"properties":{"head":{"$ref":"#/$defs/commit"},"branch":{"const":"codex/oracle-p0-1-governance"},"clean":{"const":true},"snapshot_digest":{"$ref":"#/$defs/digest"},"initial_ignored_inventory":{"$ref":"#/$defs/ignored_inventory_summary"}}},"ignored_inventory_summary":{"type":"object","additionalProperties":false,"required":["algorithm","endpoint_count","entry_count","regular_file_count","directory_count","symlink_count","regular_file_bytes","digest"],"properties":{"algorithm":{"const":"git_exclude_standard_recursive_v1"},"endpoint_count":{"type":"integer","minimum":0,"maximum":100000},"entry_count":{"type":"integer","minimum":0,"maximum":250000},"regular_file_count":{"type":"integer","minimum":0,"maximum":250000},"directory_count":{"type":"integer","minimum":0,"maximum":250000},"symlink_count":{"type":"integer","minimum":0,"maximum":250000},"regular_file_bytes":{"type":"integer","minimum":0,"maximum":1073741824},"digest":{"$ref":"#/$defs/digest"}}},"commit_identity":{"type":"object","additionalProperties":false,"required":["author_name","author_email","committer_name","committer_email"],"properties":{"author_name":{"type":"string","minLength":1,"maxLength":256,"pattern":"^[^\\u0000-\\u001f\\u007f]+$"},"author_email":{"type":"string","minLength":3,"maxLength":256,"pattern":"^[^\\u0000-\\u001f\\u007f@]+@[^\\u0000-\\u001f\\u007f@]+$"},"committer_name":{"type":"string","minLength":1,"maxLength":256,"pattern":"^[^\\u0000-\\u001f\\u007f]+$"},"committer_email":{"type":"string","minLength":3,"maxLength":256,"pattern":"^[^\\u0000-\\u001f\\u007f@]+@[^\\u0000-\\u001f\\u007f@]+$"}}},"codegraph":{"type":"object","additionalProperties":false,"required":["version","up_to_date","index_digest","file_count","node_count","edge_count"],"properties":{"version":{"const":"1.1.6"},"up_to_date":{"const":true},"index_digest":{"$ref":"#/$defs/digest"},"file_count":{"type":"integer","minimum":1},"node_count":{"type":"integer","minimum":1},"edge_count":{"type":"integer","minimum":1}}}}}
