{"approval_attestation_head":"5c575e48f1add9d17d5990eceffa2619dd15d774","artifact_chain":{"context":"docs/superpowers/evidence/p0-1/p0-1-context.json","controller_report":"docs/superpowers/evidence/p0-1/controller-final-report.json","controller_report_markdown":"docs/superpowers/evidence/p0-1/controller-final-report.md","exit":"docs/superpowers/evidence/p0-1/p0-1-exit-baseline.json","green":"docs/superpowers/evidence/p0-1/p0-1-green-results.json","handoff":"docs/superpowers/evidence/p0-1/p0-1-handoff.json","receipt":"docs/superpowers/evidence/p0-1/p0-1-successor-receipt.json","red":"docs/superpowers/evidence/p0-1/p0-1-red-results.json","report":"docs/superpowers/evidence/p0-1/p0-1-exit-report.json","report_markdown":"docs/superpowers/evidence/p0-1/p0-1-exit-report.md","results":"docs/superpowers/evidence/p0-1/p0-1-command-results.json"},"candidate_commit_identities":{"cc_gateway":{"author_email":"369492318@qq.com","author_name":"muqihang","committer_email":"369492318@qq.com","committer_name":"muqihang"},"sub2api":{"author_email":"369492318@qq.com","author_name":"muqihang","committer_email":"369492318@qq.com","committer_name":"muqihang"}},"capture_inputs":{"bounded_file_read":{"digest":"sha256:d9bf8a4085e9fa4413ae16c2c5b0a025d57d742e63edeb76f22ef60ba14f4c98","path":"tools/oracle-lab/bounded-file-read.ts"},"bounded_repository_state":{"digest":"sha256:65545c211d71df56fae438b5085ba90569bf79fcdbd5a39614eaab7153f3b7c8","path":"tools/oracle-lab/bounded-repository-state.ts"},"catalog_schema":{"digest":"sha256:4d536964db35b8bacd02851a0317bccd49ff3b2eeb70ff29a0da832587be8a8d","path":"docs/superpowers/schemas/oracle-lab-governance-amendment-command-catalog.schema.json"},"command_catalog":{"digest":"sha256:82e6dcd3e681fcb3aac606bd5538767324d534cccf6ff3813082c60e965bf526","path":"docs/superpowers/registry/oracle-lab-governance-amendment-command-catalog.json"},"context_schema":{"digest":"sha256:aae228a606185ba0cd15d1014e40c593a29b20ac3bfb199fb1bdf7e59530d83a","path":"docs/superpowers/schemas/oracle-lab-governance-amendment-context.schema.json"},"exit_schema":{"digest":"sha256:829653db52494eea0327b50c45454a91e35bd16fdacb752a3f6ee06b2e37cbca","path":"docs/superpowers/schemas/oracle-lab-governance-amendment-exit.schema.json"},"handoff_schema":{"digest":"sha256:a194624515873f1dc0be81a3c1963bbe444570c3ae66319df6742bf0cdcb8a11","path":"docs/superpowers/schemas/oracle-lab-governance-amendment-handoff.schema.json"},"ignored_path_inventory":{"digest":"sha256:0dbf8732065aa5ac331f5f67c9d2905dec3c9caa428aab9bbf1ff71adf939ac6","path":"tools/oracle-lab/ignored-path-inventory.ts"},"launcher":{"digest":"sha256:47d3245039d0c5523ec4f86a504e78a0308da2aca891463eb279ee065b74db09","path":"tools/oracle-lab/oracle-p0-1"},"receipt_schema":{"digest":"sha256:2954d99bcab64617e4240992058a1ac8600d5c6146dcceb79dd2522119236fa6","path":"docs/superpowers/schemas/oracle-lab-governance-amendment-receipt.schema.json"},"report_schema":{"digest":"sha256:e54397eea26fade5e10f6a65bc63a0f240f62a219bd6d54fce690a3fbee46be3","path":"docs/superpowers/schemas/oracle-lab-governance-amendment-report.schema.json"},"results_schema":{"digest":"sha256:adf9350956fa942fdc79f1021bf3d001f82f719bd51cda2dd021774bcf4635e9","path":"docs/superpowers/schemas/oracle-lab-governance-amendment-command-results.schema.json"},"review_import_schema":{"digest":"sha256:958cec4ae04f3f3cd02b7852fdfee0e0b5c4dc4078c7f6f850c0a1fcb340b294","path":"docs/superpowers/schemas/oracle-lab-governance-amendment-review-import.schema.json"},"review_schema":{"digest":"sha256:f4944dae636912b0b1e9fe96b5eae237e442128b1abf7f4579c218da604d4c35","path":"docs/superpowers/schemas/oracle-lab-governance-amendment-review.schema.json"},"reviewed_toolchain":{"digest":"sha256:997244a696f100b6e9dc1a4c8a1e569079a2334eef23facb6138075c15853d2f","path":"docs/superpowers/registry/oracle-lab-p0-1-reviewed-toolchain.json"},"reviewed_toolchain_schema":{"digest":"sha256:e80c89b197fd2469756099b5006cc80a7f308d5099bb2811d883b50b6c471044","path":"docs/superpowers/schemas/oracle-lab-p0-1-reviewed-toolchain.schema.json"},"secure_runtime":{"digest":"sha256:8828ca3c5f22dee9256d5ff52d3eccadfd71386d2d719b31aee696aa5fe56a69","path":"tools/oracle-lab/secure-runtime.ts"},"successor_tool":{"digest":"sha256:372962b3df3cdcf538deef95024e0387a6e01620c17b49b16ae11656adbb0121","path":"tools/oracle-lab/governance-amendment-evidence.ts"},"trusted_reviewers":{"digest":"sha256:8116b284cd47217f3a217af7e348bc0a555b79421179aae1ee9cd4010227d87d","path":"docs/superpowers/registry/oracle-lab-p0-1-trusted-reviewers.json"},"trusted_reviewers_schema":{"digest":"sha256:de0526c27e9c0bd88c67e2f13a204209c15b0bb2628fce6757dc0eb4d9c6fce1","path":"docs/superpowers/schemas/oracle-lab-p0-1-trusted-reviewers.schema.json"}},"codegraph":{"cc_gateway":{"edge_count":18565,"file_count":118,"index_digest":"sha256:03187d708f4aaa18a986216af9b9c9cb524a3696a7dc6946f17b7aaa26b10ab6","node_count":4744,"up_to_date":true,"version":"1.1.6"},"sub2api":{"edge_count":328727,"file_count":3042,"index_digest":"sha256:052bb6ded74b1742a6b6aa0968ecf11c61588f940deea9942092b39598d9d3cf","node_count":98075,"up_to_date":true,"version":"1.1.6"}},"disabled_capabilities":["real_upstream_access","real_credentials","provider_internal_authority","profile_promotion","production_deployment","real_canary","direct_egress_trust","unverified_pinned_wire_claims","unsupported_negative_capabilities","expired_or_missing_negative_capabilities","unrestricted_capture","external_network_requests"],"entry":{"digest":"sha256:e6d7426c63f8bf96a91de5c47d9fc6807fae5da68ad507e8ba65b93f2732f235","path":"docs/superpowers/evidence/p0-1/p0-1-entry-baseline.json"},"entry_receipt":{"digest":"sha256:f787ea8bfd1e7f640719dbba11f8e4835d468bed1045e82faa50561bdbcf9d06","path":"docs/superpowers/evidence/p0-1/p0-1-entry-baseline.receipt.json"},"exit_digest":"sha256:5c089649df77ba8729e05954a98b01513bff362d117ed3ed19d8be1c726ecbda","exit_kind":"governance_amendment_exit","generated_at":"2026-07-15T00:24:02.567Z","governance":{"amendment":{"digest":"sha256:6883d66d74bd1e92f97625348c67559aa56c1f5e7542398635228a88814c57b2","path":"docs/superpowers/specs/2026-07-12-claude-code-2.1.207-oracle-lab-review-amendments.md"},"claims":{"digest":"sha256:a968bf2efbff6768cb79761fe60787487494e12d239cf13563de775b177c3cd0","path":"docs/superpowers/registry/oracle-lab-claims.json"},"observations":{"digest":"sha256:7cee754f183a236611ce5c924c7d5267d4bb41509b8563bc50f61de05e8db2a2","path":"docs/superpowers/registry/oracle-lab-current-observations.json"},"plan":{"digest":"sha256:9d6818f31274cb2b41f1220776ab3749b43478ec762720be598af5fa9f2ee26b","path":"docs/superpowers/plans/2026-07-12-claude-code-2.1.207-p0-1-wp-r0-governance-reconciliation.md"},"requirement_schema":{"digest":"sha256:b1297ff15118b827ae9fab056c57554ca575b09b782f663d10535087bd11f8cd","path":"docs/superpowers/schemas/oracle-lab-requirement.schema.json"},"requirement_validator":{"digest":"sha256:c13f7c0ded465209150b979cea9c1e8d681e27249386591ed0b4fd6b3ab7154c","path":"tools/oracle-lab/validate-requirements.ts"},"requirements":{"digest":"sha256:875086715d3a05b0af81fdc2d0bf2988a61106621f632f87efdb5d76f2492772","path":"docs/superpowers/registry/oracle-lab-requirements.json"},"requirements_review":{"digest":"sha256:f3336bbe01b1a567c375ec12fdb4f05250ee1af518d10b7107564580d0eeb8b3","path":"docs/superpowers/evidence/p0-1/requirements-review.json"},"review_import":{"digest":"sha256:c8849e572728ba66ce9cb73b73185130eab47160df48c7ac01b25cd75467e020","path":"docs/superpowers/evidence/p0-1/p0-1-review-import.json"},"roadmap":{"digest":"sha256:87e0ee04ab1beba573ee47e1ba7da7c5c06dbbcc5e6d63fb1f15703549e0f407","path":"docs/superpowers/roadmaps/2026-07-11-claude-code-2.1.207-oracle-lab-roadmap.md"},"security_review":{"digest":"sha256:1c068def53e9192a5d0fb74dccd1c732091aa90c7c2e5da5b2d739d87370dae8","path":"docs/superpowers/evidence/p0-1/security-quality-review.json"}},"parent_receipts":{"phase_zero":{"digest":"sha256:5a2bef840e04d6533bfc657520c73cbc8fcc5f27ede181d168d9b2bf8a3fedee","path":"docs/superpowers/evidence/phase-0/phase-0-exit-receipt.json"},"post_integration_v2":{"digest":"sha256:c6b64e233dfa2df8c4cd8937aa2b8552ac54c68d4593a32a837af20d4923fb64","path":"docs/superpowers/evidence/post-integration-v2/post-integration-receipt.json"}},"repositories":{"cc_gateway":{"branch":"codex/oracle-p0-1-governance","clean":true,"head":"5c575e48f1add9d17d5990eceffa2619dd15d774","initial_ignored_inventory":{"algorithm":"git_exclude_standard_recursive_v1","digest":"sha256:adc46ef925bcbd0eaf517fa58134fd4945ecb87594bcb9723dfb3dc42148c526","directory_count":166,"endpoint_count":90,"entry_count":1531,"regular_file_bytes":75918024,"regular_file_count":1360,"symlink_count":5},"snapshot_digest":"sha256:14e10cfcf29cf9859d581f24f694a1ce83b3b8d06bca5a3974333044af97e32b"},"sub2api":{"branch":"codex/oracle-p0-1-governance","clean":true,"head":"0a97b3f3b84b5c679788b3694d5840e235031f07","initial_ignored_inventory":{"algorithm":"git_exclude_standard_recursive_v1","digest":"sha256:246f3f6342302013ac03ba58207472a0dc424f5e9252a4dbc946652e6eb4afc8","directory_count":5,"endpoint_count":3,"entry_count":11,"regular_file_bytes":311908446,"regular_file_count":6,"symlink_count":0},"snapshot_digest":"sha256:d3f263173c0ff508a321f72b3116f2a9ff1ea4427dce87a75e806868fe22be52"}},"reviewed_candidate_heads":{"cc_gateway":"1c2167aac6158eb4dc9cfe3dfb4339c925eabae4","sub2api":"0a97b3f3b84b5c679788b3694d5840e235031f07"},"schema_version":1,"shared_contract":{"digest":"sha256:70c26db06e9135db31d08f097573e3fd55bd9a8894614832eefeecabf6b1a3d1","path":"backend/internal/service/testdata/cc_gateway_formal_pool_contract/vectors.json"}}
